listing_date;title;company;location;work_type;link
21-Oct-24 07:45;Senior Backend Developer;PT Inovasi Dunia Gim;Tangerang;Full time;https://www.jobstreet.co.id/job/79640372
21-Oct-24 08:18;Backend Engineer, Digital Venture - Fully REMOTE;CP AXTRA PUBLIC COMPANY LIMITED;Jakarta;Contract/Temp;https://www.jobstreet.co.id/job/79641095
23-Oct-24 08:33;Back End Developer;PT. Cyberindo Mega Persada (CBN Cloud);South Jakarta;Contract/Temp;https://www.jobstreet.co.id/job/79705818
17-Oct-24 12:26;Back-End Developer;PT Nusantara Sejahtera Raya Tbk (Cinema XXI);Central Jakarta;Full time;https://www.jobstreet.co.id/job/79580141
23-Oct-24 06:53;Backend Engineer (Node.js);PT Nomura Research Institute Indonesia;Jakarta;Contract/Temp;https://www.jobstreet.co.id/job/79042524
23-Oct-24 06:50;Fullstack Engineer (Python);Private Advertiser;South Jakarta;Full time;https://www.jobstreet.co.id/job/79703760
21-Oct-24 01:39;Back End Developer;PT Trimitra Indoplast Mandiri;Central Jakarta;Full time;https://www.jobstreet.co.id/job/79628175
20-Oct-24 09:36;Senior Fullstack Developer;PT. Ezsy Deltamax Indonesia;Semarang;Full time;https://www.jobstreet.co.id/job/79621823
23-Oct-24 07:59;IT JAVA Programmer (Junior);PT Hitachi eBworx Indonesia;Central Jakarta;Full time;https://www.jobstreet.co.id/job/79705258
18-Oct-24 11:39;BACK-END DEVELOPER;PT Nusantara Sakti Group (JAKARTA);Jakarta;Full time;https://www.jobstreet.co.id/job/79607486
17-Oct-24 10:47;Full Stack Engineer;PT DIGITAL XCELERATION NUSANTARA;South Jakarta;Full time;https://www.jobstreet.co.id/job/79579262
23-Oct-24 07:19;IT Programmer Staff;PT Turnaround Asset Indonesia;South Jakarta;Contract/Temp;https://www.jobstreet.co.id/job/79704451
22-Oct-24 07:11;Backend Engineer;PT. Sukses Corp International;Central Jakarta;Full time;https://www.jobstreet.co.id/job/79676596
20-Oct-24 16:58;Back End Developer Java;PT. HTC Global Software Services;Central Jakarta;Contract/Temp;https://www.jobstreet.co.id/job/79622906
22-Oct-24 09:30;Backend Engineer;PT Trinusa Travelindo;Jakarta;Full time;https://www.jobstreet.co.id/job/79687725
18-Oct-24 08:44;Full Stack Developer - Java Script full-time onsite;Private Advertiser;Bekasi Regency;Full time;https://www.jobstreet.co.id/job/79603810
23-Oct-24 10:41;Full-Stack Developer;PT Sentul City Tbk. (HR Division);Bogor Regency;Full time;https://www.jobstreet.co.id/job/79709046
21-Oct-24 07:40;Full-stack Engineer, Digital Venture - Fully REMOTE;CP AXTRA PUBLIC COMPANY LIMITED;Jakarta;Contract/Temp;https://www.jobstreet.co.id/job/79640268
23-Oct-24 02:19;Back-End Engineer;PT Sky Parking Utama;Banten;Full time;https://www.jobstreet.co.id/job/79693991
21-Oct-24 11:31;R&D Staff (Software Developer);PT. DCT TOTAL SOLUTIONS;Bekasi;Full time;https://www.jobstreet.co.id/job/79644866
22-Oct-24 09:30;Software Engineer - Backend (Corporate Technology);PT Trinusa Travelindo;Jakarta;Full time;https://www.jobstreet.co.id/job/79687696
18-Oct-24 03:36;Java Developer;PT Indocyber Global Teknologi;Jakarta;Contract/Temp;https://www.jobstreet.co.id/job/79594600
18-Oct-24 09:51;Senior .NET Developer;Serial Microelectronics Pte Ltd;Jakarta;Full time;https://www.jobstreet.co.id/job/79606337
21-Oct-24 03:03;Senior Golang Developer;PT UQPAY TECHNOLOGY INDONESIA;Jakarta;Full time;https://www.jobstreet.co.id/job/79630827
22-Oct-24 22:20;Lead Software Engineer (IC);PT Aplikasi Karya Anak Bangsa (GO-JEK Indonesia);Jakarta;Full time;https://www.jobstreet.co.id/job/79691176
17-Oct-24 07:55;Senior Software Engineer (Remote);Vouch SG Pte Ltd;Jakarta;Full time;https://www.jobstreet.co.id/job/79575110
23-Oct-24 10:56;Front End (Angular) Developer;PT Lawencon Internasional;South Jakarta;Full time;https://www.jobstreet.co.id/job/79709172
18-Oct-24 08:20;Full Stack Developer;PT. Metrodata Electronics, Tbk;West Jakarta;Contract/Temp;https://www.jobstreet.co.id/job/79603304
18-Oct-24 10:10;IT Senior Programmer;PT Bhakti Idola Tama;West Jakarta;Casual/Vacation;https://www.jobstreet.co.id/job/79603042
23-Oct-24 09:54;Full Stack Developer;PT Mitra Belanja Bersama;North Jakarta;Full time;https://www.jobstreet.co.id/job/79705825
21-Oct-24 12:00;Senior Analyst - Innovation Cloud Development Center - Outsystems Developer - ID;Deloitte;Jakarta;Full time;https://www.jobstreet.co.id/job/79648202
22-Oct-24 05:41;Senior Software Engineer/Back End Engineer (Java);PT. Wide Technologies Indonesia;Jakarta;Full time;https://www.jobstreet.co.id/job/79670623
21-Oct-24 03:15;Front End Developer;PT UQPAY TECHNOLOGY INDONESIA;Jakarta;Full time;https://www.jobstreet.co.id/job/79631321
22-Oct-24 08:43;Fullstack Developer;PT Anabatic Technologies;Tangerang;Full time;https://www.jobstreet.co.id/job/79678470
22-Oct-24 02:53;Fullstack Developer;PT Graha Karya Informasi;Bekasi Regency;Contract/Temp;https://www.jobstreet.co.id/job/79656515
23-Oct-24 06:11;Junior Software Engineer (Front End);Nostra Solution;South Jakarta;Contract/Temp;https://www.jobstreet.co.id/job/79701237
23-Oct-24 02:33;IT Development Web;PT. Garuda Mart Indonesia;Bekasi;Contract/Temp;https://www.jobstreet.co.id/job/79694353
23-Oct-24 02:26;Java Developer;PT Infomedia Solusi Humanika;Jakarta;Full time;https://www.jobstreet.co.id/job/79694189
22-Oct-24 03:30;IT PROGRAMMER;PT Mandjur Sehat Abadi;Central Jakarta;Full time;https://www.jobstreet.co.id/job/79659081
23-Oct-24 03:07;Senior React Developer - Remote Work;PT Pippeline Technologies Indonesia;Jakarta;Contract/Temp;https://www.jobstreet.co.id/job/79695621
23-Oct-24 03:04;Senior React Developer - Remote Work;PT Pippeline Technologies Indonesia;Bali;Contract/Temp;https://www.jobstreet.co.id/job/79695552
18-Oct-24 01:58;WEB DEVELOPER;PT Anomali Lintas Cakrawala;South Jakarta;Full time;https://www.jobstreet.co.id/job/79590916
17-Oct-24 04:23;Full Stack Programmer;PT Royal Sutan Agung;East Jakarta;Full time;https://www.jobstreet.co.id/job/79568720
22-Oct-24 06:14;Programmer (Placement in Denpasar, Bali);Marketbiz.Net;Denpasar;Full time;https://www.jobstreet.co.id/job/79671617
22-Oct-24 02:32;DEVELOPER SUPERVISOR;PT Ras Digital Media;South Jakarta;Contract/Temp;https://www.jobstreet.co.id/job/79655800
22-Oct-24 06:04;Frontend Engineer;PT SOD Technology Indonesia;Jakarta;Full time;https://www.jobstreet.co.id/job/79671440
22-Oct-24 01:33;APPLICATION DEVELOPER STAFF;PT Usaha Prima Nusantara;Medan;Full time;https://www.jobstreet.co.id/job/79653885
22-Oct-24 06:32;Mobile Developer (Yogyakarta);PT Sarana Yukti Bandhana;Yogyakarta Special Region;Full time;https://www.jobstreet.co.id/job/79674179
22-Oct-24 04:29;Senior Software Development Engineer in Test/SDET (Katalon);PT. Wide Technologies Indonesia;South Jakarta;Full time;https://www.jobstreet.co.id/job/79668707
22-Oct-24 12:48;ODOO DEVELOPER;PT IGP Internasional;Yogyakarta Special Region;Contract/Temp;https://www.jobstreet.co.id/job/79685143
22-Oct-24 04:18;Python Developer;PT Bumi Amartha Teknologi Mandiri;South Jakarta;Contract/Temp;https://www.jobstreet.co.id/job/79668376
21-Oct-24 08:08;Java Developer;PT Mediatama Indo Teknologi;East Jakarta;Full time;https://www.jobstreet.co.id/job/79333653
21-Oct-24 07:55;Programmer;Dunia Wahana Hiburan;Tangerang Regency;Full time;https://www.jobstreet.co.id/job/79640633
21-Oct-24 03:06;Full Stack PHP Developer - Jakarta Barat;PT Lippo Malls Indonesia;West Jakarta;Full time;https://www.jobstreet.co.id/job/79631046
21-Oct-24 07:15;Fullstack Developer;PT Karisma Zona Kreatifku;Surabaya;Contract/Temp;https://www.jobstreet.co.id/job/79639725
21-Oct-24 07:19;Senior Web Programmer;PT Aldmic Indonesia;West Jakarta;Full time;https://www.jobstreet.co.id/job/79639815
21-Oct-24 10:26;ODOO Developer;PT Diesel Utama Indonesia (Diesel One Group);Central Jakarta;Full time;https://www.jobstreet.co.id/job/79644370
21-Oct-24 02:17;IT PROGRAMMER;PT Bangun Putra Pesaka;North Jakarta;Full time;https://www.jobstreet.co.id/job/79629263
19-Oct-24 10:00;IT Programmer;PT Jayabaya Pratama;South Jakarta;Contract/Temp;https://www.jobstreet.co.id/job/79617674
18-Oct-24 09:55;IT - PROGRAMER;PT Hoco Asia Industry;Jakarta;Full time;https://www.jobstreet.co.id/job/79606423
18-Oct-24 08:06;Programmer;PT. Inti Talenta Teknologi;South Jakarta;Contract/Temp;https://www.jobstreet.co.id/job/79602978
21-Oct-24 12:00;PHP Developer;PT. Metrodata Electronics, Tbk;West Jakarta;Full time;https://www.jobstreet.co.id/job/79647529
18-Oct-24 09:02;Programmer;PT Hiba Utama;East Jakarta;Contract/Temp;https://www.jobstreet.co.id/job/79604520
17-Oct-24 04:06;Full Stack Developer;Savoria Group;Central Jakarta;Full time;https://www.jobstreet.co.id/job/79567769
17-Oct-24 03:00;Full Stack Java Web Developer;PT. Lua Kreatif Teknologi;Yogyakarta;Full time;https://www.jobstreet.co.id/job/79564881
17-Oct-24 03:06;Full Stack Java Web Developer;PT. Lua Kreatif Teknologi;South Jakarta;Full time;https://www.jobstreet.co.id/job/79565096
17-Oct-24 10:49;Full Stack Web Developer (PHP/Vue.js/Node.js/TypeScript);PT Digivo Kreatif Indonesia;Tangerang;Full time;https://www.jobstreet.co.id/job/79579290
17-Oct-24 09:50;Software Developer;Private Advertiser;West Jakarta;Full time;https://www.jobstreet.co.id/job/79576174
17-Oct-24 01:19;Java Programmer;PT APLIKASI KLIKPAYROLL INDONESIA;Jakarta;Full time;https://www.jobstreet.co.id/job/79406462
17-Oct-24 07:20;Senior Software Architect;PT SOD Technology Indonesia;Central Jakarta;Full time;https://www.jobstreet.co.id/job/79334705
17-Oct-24 09:10;Software Engineer;Sekolah Pelita Harapan;Tangerang;Full time;https://www.jobstreet.co.id/job/78913646
17-Oct-24 06:50;PROGRAMMER;PT Agatos Multi Solusi;Surabaya;Full time;https://www.jobstreet.co.id/job/79573754
17-Oct-24 05:54;(Mid / Senior) Android Developer;Crypto.com;Jakarta;Full time;https://www.jobstreet.co.id/job/79571004
17-Oct-24 07:12;Programmer;PT. Bakti Artha Reksa Sejahtera;North Jakarta;Full time;https://www.jobstreet.co.id/job/79574229
17-Oct-24 02:52;Mobile Developer;PT Digital Mediatama Maxima Tbk.;South Jakarta;Full time;https://www.jobstreet.co.id/job/79564467
17-Oct-24 08:00;Software Engineer Lead/Manager - Web;PT Trinusa Travelindo;Jakarta;Full time;https://www.jobstreet.co.id/job/79584250
22-Oct-24 07:50;Backend Developer;ASAP Lombok;Lombok;Full time;https://www.jobstreet.co.id/job/79677406
22-Oct-24 07:58;Backend Programmer;PT Wira Lahana Sukses;Batam;Full time;https://www.jobstreet.co.id/job/79677555
22-Oct-24 14:00;Back End Engineer (Marketing Automation);TryAds;Bali;Full time;https://www.jobstreet.co.id/job/79686716
22-Oct-24 13:55;Software Engineer (Backend) - Consumer Experience;PT Fliptech Lentera Inspirasi Pertiwi;Jakarta;Full time;https://www.jobstreet.co.id/job/79685888
21-Oct-24 22:25;Live Ops-Backend Engineer - Southeast Asia;Bisonic;Jakarta;Full time;https://www.jobstreet.co.id/job/79680040
21-Oct-24 12:54;Software Engineer;PT Paragon Pratama Teknologi;Central Jakarta;Full time;https://www.jobstreet.co.id/job/79647493
19-Oct-24 05:54;Senior Software Engineer;PT Magna Finance Tbk;South Jakarta;Full time;https://www.jobstreet.co.id/job/79660470
19-Oct-24 05:54;Lead Software Engineer;PT Magna Finance Tbk;South Jakarta;Full time;https://www.jobstreet.co.id/job/79660084
21-Oct-24 03:44;Front End Developer;PT Foxi Media International;Batam;Full time;https://www.jobstreet.co.id/job/79632461
23-Oct-24 15:07;Unity Developer SDK;TryAds;Bali;Full time;https://www.jobstreet.co.id/job/79712825
23-Oct-24 06:57;Senior Web Developer;SATUVISION Digital Agency;Denpasar;Full time;https://www.jobstreet.co.id/job/79703908
17-Oct-24 02:05;Web Developer;PT Active Study Indonesia;Jakarta;Full time;https://www.jobstreet.co.id/job/79563023
23-Oct-24 00:18;Frontend Developer;PT Island Management;Denpasar;Full time;https://www.jobstreet.co.id/job/79690873
22-Oct-24 20:23;Programmer;PT Gerbang Teknologi Nasional;Medan;Full time;https://www.jobstreet.co.id/job/79685447
21-Oct-24 04:20;Fullstack Developer Associate Manager;PT Alto Network;Central Java;Full time;https://www.jobstreet.co.id/job/79638129
21-Oct-24 12:00;PHP Developer;PT Mitra Integrasi Informatika - Metrodata Group;Jakarta;Full time;https://www.jobstreet.co.id/job/79659766
21-Oct-24 00:45;Frontend Engineer;Linx Labs Pte Ltd;Bali;Full time;https://www.jobstreet.co.id/job/79504306
19-Oct-24 05:54;Senior Software Engineer- Testing;PT Magna Finance Tbk;South Jakarta;Full time;https://www.jobstreet.co.id/job/79660555
19-Oct-24 04:29;Karyawan;MAXXIMUM DIGITAL;Cimahi;Full time;https://www.jobstreet.co.id/job/79616549
18-Oct-24 08:02;Software Engineer (On-site);Integrity;Jakarta;Full time;https://www.jobstreet.co.id/job/79607946
21-Oct-24 07:47;Backend Developer;Gefami Services Indonesia;Jakarta;Contract/Temp;https://www.jobstreet.co.id/job/79648215
22-Oct-24 08:20;Software Engineer (Golang);PT Iforte Payment Infrastructure;Jakarta;Contract/Temp;https://www.jobstreet.co.id/job/79686668
17-Oct-24 06:50;DevOps;Gefami Services Indonesia;Jakarta;Contract/Temp;https://www.jobstreet.co.id/job/79580415
20-Oct-24 02:24;IT PRODUCT LEADS;PT PERSADA;South Jakarta;Full time;https://www.jobstreet.co.id/job/79672281
