listing_date;title;company;location;work_type;link
03-Oct-24 03:21;System Analyst - IT Solution & Services - WFO - Jakarta;PT. PERSOLKELLY Recruitment Indonesia;Jakarta;Contract/Temp;https://www.jobstreet.co.id/job/79252296
04-Oct-24 07:57;SYSTEM ANALYST;PT Kinarya Alihdaya Mandiri;West Jakarta;Full time;https://www.jobstreet.co.id/job/79297655
04-Oct-24 03:00;IT ERP (Sr. Staff - Supervisor);PT. JAYA BERSAMA  SAPUTRA PERKASA;Tangerang Regency;Contract/Temp;https://www.jobstreet.co.id/job/79280353
04-Oct-24 09:11;IT System Requirement Analyst (JS - IT SRA);OTO Group;South Jakarta;Full time;https://www.jobstreet.co.id/job/79299904
04-Oct-24 04:47;Junior Business Analyst;PT Perangkat Lunak Indonesia;Central Jakarta;Full time;https://www.jobstreet.co.id/job/79290310
01-Oct-24 07:04;System Analyst;PT XSIS MITRA UTAMA - Recruitment Center;South Jakarta;Full time;https://www.jobstreet.co.id/job/79205047
02-Oct-24 01:48;System Analyst;Steradian Data Optima;Jakarta;Full time;https://www.jobstreet.co.id/job/79220326
02-Oct-24 02:39;System Analyst;PT Ako Media Asia;West Jakarta;Full time;https://www.jobstreet.co.id/job/79222044
02-Oct-24 07:00;DATA ANALYST – HR SYSTEM;PT Amman Mineral Nusa Tenggara;West Sumbawa;Full time;https://www.jobstreet.co.id/job/79232310
03-Oct-24 09:40;Business Analyst (Contract Base);PT ZURICH ASURANSI INDONESIA, Tbk;Jakarta;Full time;https://www.jobstreet.co.id/job/79265607
04-Oct-24 04:00;Product Operations Analyst;PT Trinusa Travelindo;Jakarta;Full time;https://www.jobstreet.co.id/job/79303863
01-Oct-24 02:55;Business Analyst (Banking Core);PT Karya Solusi Prima Sejahtera;South Tangerang;Full time;https://www.jobstreet.co.id/job/79195531
04-Oct-24 07:14;Technical Consultant Analyst;PT. Metrodata Electronics, Tbk;West Jakarta;Full time;https://www.jobstreet.co.id/job/79301146
04-Oct-24 03:23;ERP Senior Staff;Indonesia Equipment Centre;North Jakarta;Contract/Temp;https://www.jobstreet.co.id/job/79280912
01-Oct-24 07:33;IT Technical Consultant (Application Support);PT Buana Finance Tbk;Jakarta;Full time;https://www.jobstreet.co.id/job/79205784
01-Oct-24 03:30;RPA Business Analyst;PT Trinusa Travelindo;Jakarta;Full time;https://www.jobstreet.co.id/job/79209100
01-Oct-24 08:10;Application Support Manager;Private Advertiser;Jakarta;Full time;https://www.jobstreet.co.id/job/79206539
30-Sep-24 07:40;Consultant Business Analyst;PT Karisma Zona Kreatifku;South Jakarta;Contract/Temp;https://www.jobstreet.co.id/job/79177771
01-Oct-24 04:02;IT Project Management Support Officer;Yayasan Bina Nusantara;Jakarta;Full time;https://www.jobstreet.co.id/job/79198849
03-Oct-24 02:38;IT Project Manager;Trans Retail Group;South Jakarta;Full time;https://www.jobstreet.co.id/job/79250725
04-Oct-24 03:06;AI System Integrator;Private Advertiser;Jakarta;Full time;https://www.jobstreet.co.id/job/79280534
01-Oct-24 03:45;Senior Data Analyst;Yayasan Bina Nusantara;West Jakarta;Full time;https://www.jobstreet.co.id/job/79198351
30-Sep-24 11:00;Dynamics365 Functional Consultant;Technosoft Group;West Jakarta;Full time;https://www.jobstreet.co.id/job/79183646
03-Oct-24 04:06;Business Process Improvement Analyst;PT. Rupa Aestetika Teknologi Aktual (RATA);Jakarta;Full time;https://www.jobstreet.co.id/job/79254129
03-Oct-24 02:58;Business Analyst Manager;PT Tigaraksa Satria, Tbk;South Jakarta;Full time;https://www.jobstreet.co.id/job/79251433
03-Oct-24 05:46;Functional Application Consultant;PT IFCA Property365 Indonesia;South Jakarta;Full time;https://www.jobstreet.co.id/job/79256714
03-Oct-24 03:27;ICT Operational Supervisor;PT Maybank Indonesia Finance;Central Jakarta;Full time;https://www.jobstreet.co.id/job/79252562
01-Oct-24 07:01;IT WEB DEVELOPER (.NET CORE);PT Mega Central Finance;West Jakarta;Full time;https://www.jobstreet.co.id/job/79204961
03-Oct-24 09:55;Product Solution;PT Multi Bangun Abadi;South Jakarta;Contract/Temp;https://www.jobstreet.co.id/job/79266446
03-Oct-24 05:20;ERP Consultant;PT Talentvis Consulting Indonesia;South Jakarta;Full time;https://www.jobstreet.co.id/job/79256158
03-Oct-24 09:52;IT Manager;Private Advertiser;Central Jakarta;Full time;https://www.jobstreet.co.id/job/79266436
03-Oct-24 05:05;IT Infrastructure Specialist;PT Adibayu Gajah Semakmur;Yogyakarta Special Region;Contract/Temp;https://www.jobstreet.co.id/job/79253514
03-Oct-24 08:48;Oracle EBS Consultant (Technical);Hand International Pte. Ltd.;Central Jakarta;Full time;https://www.jobstreet.co.id/job/79262959
03-Oct-24 02:57;ERP Administrator;PT Natural Java Spice;East Java;Full time;https://www.jobstreet.co.id/job/79251340
03-Oct-24 08:01;Head of IT - Banking;PT Michael Page Internasional Indonesia;Jakarta;Full time;https://www.jobstreet.co.id/job/79261963
03-Oct-24 14:42;Software Project Manager;PT Inovasi Kreatif Digital;Jakarta;Full time;https://www.jobstreet.co.id/job/79268776
03-Oct-24 08:01;IT Programmer (Dynamics AX);PT. Akasha Wira International Tbk;South Jakarta;Full time;https://www.jobstreet.co.id/job/79261949
03-Oct-24 06:42;IT System Operation Staff;PT Kb Valbury Sekuritas;Jakarta;Full time;https://www.jobstreet.co.id/job/79259861
03-Oct-24 05:47;SAP ABAP;PT Esha Parama Teknologi;Jakarta;Full time;https://www.jobstreet.co.id/job/79256905
03-Oct-24 03:38;SAP ABAP Consultant;PT. Metrodata Electronics, Tbk;West Jakarta;Full time;https://www.jobstreet.co.id/job/79253070
02-Oct-24 03:18;IT System Analyst;PT Astra Otoparts Tbk;Karawang;Full time;https://www.jobstreet.co.id/job/79223544
02-Oct-24 09:19;IT - Business Application Support & Development Officer;PT Garudafood Putra Putri Jaya;South Jakarta;Full time;https://www.jobstreet.co.id/job/79235720
02-Oct-24 11:15;Business Analyst Asistant Manager;PT Inovasi Karya International;West Jakarta;Full time;https://www.jobstreet.co.id/job/79238066
02-Oct-24 12:00;Functional Consultant Analyst;PT. Metrodata Electronics, Tbk;West Jakarta;Full time;https://www.jobstreet.co.id/job/79265164
02-Oct-24 03:41;Assistant Manager Operation Technology Project;PT Mitra Transaksi Indonesia;South Jakarta;Casual/Vacation;https://www.jobstreet.co.id/job/79224522
02-Oct-24 04:10;SAP ABAP Support;PT Supernova Flexible Packaging;Bekasi;Contract/Temp;https://www.jobstreet.co.id/job/79225474
02-Oct-24 08:29;IT Developer;PT Ameliore Solusi Analitika;Jakarta;Contract/Temp;https://www.jobstreet.co.id/job/79234472
02-Oct-24 07:32;IT Development;PT Dragon Pack;Central Jakarta;Full time;https://www.jobstreet.co.id/job/79233180
02-Oct-24 03:30;Data Analyst - Pricing;PT Trinusa Travelindo;Jakarta;Full time;https://www.jobstreet.co.id/job/79235909
02-Oct-24 06:43;Driver Swadaya Lead (Analytics & Growth);PT Aplikasi Karya Anak Bangsa (GO-JEK Indonesia);Jakarta;Full time;https://www.jobstreet.co.id/job/79235915
02-Oct-24 03:43;Corporate Resilience Management & Technical Development, Intern;ASIA PULP AND PAPER;South Tangerang;Contract/Temp;https://www.jobstreet.co.id/job/79224580
02-Oct-24 02:01;IT PM Business Analyst;PT Insura Media Solusi (Jakarta);Jakarta;Full time;https://www.jobstreet.co.id/job/79220766
01-Oct-24 03:29;IT Business Process Improvement Specialist;PT. Wide Technologies Indonesia;South Jakarta;Full time;https://www.jobstreet.co.id/job/79196993
01-Oct-24 04:06;ERP Application Consultant;PT. Metrodata Electronics, Tbk;West Jakarta;Full time;https://www.jobstreet.co.id/job/79198957
01-Oct-24 03:17;Junior Configurator System Lead;PT KALBE FARMA (CORPORATE);Central Jakarta;Full time;https://www.jobstreet.co.id/job/79196376
01-Oct-24 10:08;Junior Bisnis Analis Odoo;PT Profluid (Jakarta);Bekasi;Contract/Temp;https://www.jobstreet.co.id/job/79209750
02-Oct-24 12:00;SR&T Consultant, M&A Transaction Diligence, Execution & Reporting;Deloitte;Jakarta;Full time;https://www.jobstreet.co.id/job/79242751
01-Oct-24 06:54;Project Manager - IT Consulting (A-109666);RGF HR Agent Indonesia;South Jakarta;Full time;https://www.jobstreet.co.id/job/79204744
01-Oct-24 03:07;Developer Microsoft Dynamics 365 Finance Operation;PT Astra Graphia Information Technology (AGIT);Jakarta;Contract/Temp;https://www.jobstreet.co.id/job/79196084
01-Oct-24 08:08;Junior IT Consultant;PT. Vostra Internasional;Jakarta;Full time;https://www.jobstreet.co.id/job/79206508
01-Oct-24 11:18;Cloud Operation Manager (Project Based);PT Era Awan Digital;Central Jakarta;Contract/Temp;https://www.jobstreet.co.id/job/79210296
01-Oct-24 04:02;IT Project Manager;PT Peoplyee Tech Indonesia;Jakarta;Full time;https://www.jobstreet.co.id/job/79198833
01-Oct-24 07:37;IT Application Developer;PT Buana Finance Tbk;South Jakarta;Full time;https://www.jobstreet.co.id/job/79205866
01-Oct-24 09:16;SFS FI & QM Specialist;PT Steel Pipe Industry of Indonesia Tbk;Surabaya;Full time;https://www.jobstreet.co.id/job/79208217
01-Oct-24 12:00;IT Project Manager;PT. Metrodata Electronics, Tbk;West Jakarta;Full time;https://www.jobstreet.co.id/job/79214699
02-Oct-24 02:08;Risk Analyst Supervisor;Private Advertiser;Jakarta;Casual/Vacation;https://www.jobstreet.co.id/job/79220975
01-Oct-24 04:04;IT Deployment & Asset Management Section Head;Yayasan Bina Nusantara;Jakarta;Full time;https://www.jobstreet.co.id/job/79198900
01-Oct-24 02:31;Business Analyst;PT GLOBAL LOYALTY INDONESIA;Tangerang;Full time;https://www.jobstreet.co.id/job/79194864
01-Oct-24 02:37;ERP Supervisor;PT Tangkas Cipta Optimal;Central Jakarta;Full time;https://www.jobstreet.co.id/job/79195027
30-Sep-24 11:14;Dynamics365 Technical Consultant;Technosoft Group;West Jakarta;Full time;https://www.jobstreet.co.id/job/79183720
30-Sep-24 02:55;Functional Consultant (Finance / Supply Chain Industry);PT. Elabram Systems;Bogor Regency;Contract/Temp;https://www.jobstreet.co.id/job/79167642
01-Oct-24 01:46;Organizational Development & System Digitalization;PT Pan Brothers, Tbk;Boyolali;Contract/Temp;https://www.jobstreet.co.id/job/79193552
30-Sep-24 07:14;Program Manager (Digital Automation);ASIA PULP AND PAPER;Tangerang;Full time;https://www.jobstreet.co.id/job/79177036
30-Sep-24 07:33;Solution Architect;PT PERMODALAN NASIONAL MADANI;South Jakarta;Contract/Temp;https://www.jobstreet.co.id/job/79177586
30-Sep-24 07:58;Oracle SCM / MFG Consultant (Junior);Hand International Pte. Ltd.;Central Jakarta;Full time;https://www.jobstreet.co.id/job/79178275
30-Sep-24 08:58;IT staff;PT Peoplyee Tech Indonesia;Surabaya;Full time;https://www.jobstreet.co.id/job/79179819
30-Sep-24 02:39;Data Analyst (Business Intelligence) Officer;PT Kokoh Inti Arebama Tbk (Group of SCG Indonesia);South Jakarta;Full time;https://www.jobstreet.co.id/job/79167126
30-Sep-24 06:19;Principal Product Strategist;PT Solusi Transportasi Indonesia;South Jakarta;Full time;https://www.jobstreet.co.id/job/79181628
04-Oct-24 08:14;Project Manager - IT;Shopee Internasional Indonesia;Jakarta;Full time;https://www.jobstreet.co.id/job/79304011
04-Oct-24 14:26;IT Advisory Intern;Grantt Thornton Indonesia;South Jakarta;Full time;https://www.jobstreet.co.id/job/79308917
30-Sep-24 05:17;Salesforce Business Analyst & Developer;Lamudi;Jakarta;Full time;https://www.jobstreet.co.id/job/79181583
02-Oct-24 08:52;Chubb Life - IT Core Application Support Officer;PT Chubb General Insurance Indonesia;Jakarta;Full time;https://www.jobstreet.co.id/job/79238690
01-Oct-24 15:52;Chubb Life - IT Core Application Support Officer;PT Chubb General Insurance Indonesia;Jakarta;Full time;https://www.jobstreet.co.id/job/79214719
04-Oct-24 12:00;Field Tech Analyst;PT NTT INDONESIA TECHNOLOGY;Bogor;Full time;https://www.jobstreet.co.id/job/79309012
04-Oct-24 11:17;IT Data Centre Operations;PT NTT Indonesia;South Jakarta;Full time;https://www.jobstreet.co.id/job/79306326
03-Oct-24 03:29;Loyalty and Promotions Product Manager;PT Telkomsel Ekosistem Digital;South Jakarta;Full time;https://www.jobstreet.co.id/job/79271427
02-Oct-24 12:20;Business Application Support & Development Officer;PT Garudafood Putra Putri Jaya;Jakarta;Full time;https://www.jobstreet.co.id/job/79241650
02-Oct-24 09:24;IT Supervisor;PT Soejasch Bali;Denpasar;Contract/Temp;https://www.jobstreet.co.id/job/79235892
02-Oct-24 09:03;IT Supervisor;PT Soejasch Bali;Denpasar;Full time;https://www.jobstreet.co.id/job/79238885
02-Oct-24 10:24;Technical Project Manager;PT Sea Group;Jakarta;Full time;https://www.jobstreet.co.id/job/79238947
03-Oct-24 02:45;Implementation Specialist IoT - Placement Kalimantan;PT Bima Sakti Alterra;Denpasar;Full time;https://www.jobstreet.co.id/job/79259558
01-Oct-24 08:28;Supervisor MIS (Management Information System);PT Hikmah Sejahtera;Surabaya;Full time;https://www.jobstreet.co.id/job/79211188
01-Oct-24 12:00;Technical Writer;PT Mid Solusi Nusantara (MEKARI);Jakarta;Full time;https://www.jobstreet.co.id/job/79218238
30-Sep-24 21:15;Position;PT Summarecon Agung, Tbk;Jakarta;Full time;https://www.jobstreet.co.id/job/79191831
30-Sep-24 12:53;Sr. Staff Application Support;Indofood Group;North Jakarta;Contract/Temp;https://www.jobstreet.co.id/job/79187038
30-Sep-24 00:00;Technical Lead - IVR;Flintex Consulting Pte Ltd;Jakarta;Full time;https://www.jobstreet.co.id/job/79184618
05-Oct-24 01:59;IT BA & QA Senior;PT. Pilar Teknologi Solusi;South Jakarta;Full time;https://www.jobstreet.co.id/job/79313436
04-Oct-24 08:07;Business Analyst (Exp: Banking Industry) - Full Onsite;PT. SIGMA GLOBAL TEKNOLOGI (SIGMATECH);Tangerang;Contract/Temp;https://www.jobstreet.co.id/job/79310010
04-Oct-24 07:42;Business Intelligence (Contract Based);Youtap Indonesia;Jakarta;Contract/Temp;https://www.jobstreet.co.id/job/79310024
05-Oct-24 02:00;IT SAP ABAP Developer;PT. Pilar Teknologi Solusi;South Jakarta;Full time;https://www.jobstreet.co.id/job/79313423
