listing_date;title;company;location;work_type;link
18-Oct-24 03:30;IT Data Warehouse Engineer Assistant Manager;PT Dipo Star Finance;Central Jakarta;Full time;https://www.jobstreet.co.id/job/79594300
17-Oct-24 03:34;System Engineer (Data Center);PT Nusantara Compnet Integrator;West Jakarta;Full time;https://www.jobstreet.co.id/job/79566763
23-Oct-24 02:36;Data Engineer;PT Ako Media Asia;Jakarta;Contract/Temp;https://www.jobstreet.co.id/job/79694461
23-Oct-24 04:45;Computer Vision Engineer;PT LANGGENG SUKSES ABADI TEKHNOLOGI;North Jakarta;Contract/Temp;https://www.jobstreet.co.id/job/79699093
22-Oct-24 03:24;Data Engineer;Soedarpo Informatika;West Jakarta;Full time;https://www.jobstreet.co.id/job/79658272
23-Oct-24 06:50;Fullstack Engineer (Python);Private Advertiser;South Jakarta;Full time;https://www.jobstreet.co.id/job/79703760
23-Oct-24 02:09;Data Science;PT Mowilex Indonesia;West Jakarta;Full time;https://www.jobstreet.co.id/job/79693727
22-Oct-24 07:13;System Engineer;PT Mitra Mandiri Informatika;Jakarta;Full time;https://www.jobstreet.co.id/job/79676652
21-Oct-24 12:00;Application Developer Jr.;PT. Metrodata Electronics, Tbk;West Jakarta;Full time;https://www.jobstreet.co.id/job/79647458
21-Oct-24 07:51;Machine Learning Engineer;PT Mitra Informatika;Surabaya;Full time;https://www.jobstreet.co.id/job/79640534
21-Oct-24 02:03;Database Section Head (IT);Private Advertiser;West Jakarta;Full time;https://www.jobstreet.co.id/job/79628851
17-Oct-24 11:10;Digital Security Engineer;PT. Itrust Data Teknologi;Tangerang;Full time;https://www.jobstreet.co.id/job/79575191
18-Oct-24 03:25;Security Engineer (DLP);PT. Lintas Teknologi Indonesia;South Jakarta;Full time;https://www.jobstreet.co.id/job/79594104
18-Oct-24 07:24;IT Database Engineer;PT Avows Technologies;South Jakarta;Contract/Temp;https://www.jobstreet.co.id/job/79602092
21-Oct-24 08:18;Backend Engineer, Digital Venture - Fully REMOTE;CP AXTRA PUBLIC COMPANY LIMITED;Jakarta;Contract/Temp;https://www.jobstreet.co.id/job/79641095
18-Oct-24 03:06;Onsite Engineer (DLP);PT. Lintas Teknologi Indonesia;South Jakarta;Full time;https://www.jobstreet.co.id/job/79593353
21-Oct-24 08:12;Frontend Engineer, Digital Venture - Fully REMOTE;CP AXTRA PUBLIC COMPANY LIMITED;Jakarta;Contract/Temp;https://www.jobstreet.co.id/job/79641008
17-Oct-24 04:01;Senior Security Engineer (SME-DLP);PT. Lintas Teknologi Indonesia;South Jakarta;Full time;https://www.jobstreet.co.id/job/79568088
23-Oct-24 07:57;Database & Business Intelligence;Private Advertiser;Tangerang;Full time;https://www.jobstreet.co.id/job/79705215
17-Oct-24 12:00;Data Management Specialist;PT. Metrodata Electronics, Tbk;West Jakarta;Full time;https://www.jobstreet.co.id/job/79588423
23-Oct-24 03:27;Engineer On Site (Makasar);PT Karya Solusi Prima Sejahtera;Makassar;Contract/Temp;https://www.jobstreet.co.id/job/79696514
22-Oct-24 07:30;Presales Engineer;PT Nusantara Compnet Integrator;West Jakarta;Full time;https://www.jobstreet.co.id/job/79676998
17-Oct-24 07:55;Senior Software Engineer (Remote);Vouch SG Pte Ltd;Jakarta;Full time;https://www.jobstreet.co.id/job/79575110
23-Oct-24 07:15;System Engineer;TREND NETWORK TECHNOLOGY SDN. BHD.;Jakarta;Contract/Temp;https://www.jobstreet.co.id/job/79704264
23-Oct-24 06:38;Data Center Technician 2-IT;PT Oracle Indonesia;Jakarta;Full time;https://www.jobstreet.co.id/job/79707392
23-Oct-24 07:58;Software Engineer;CV Unitek Solusi;Semarang;Full time;https://www.jobstreet.co.id/job/79705140
22-Oct-24 07:11;Backend Engineer;PT. Sukses Corp International;Central Jakarta;Full time;https://www.jobstreet.co.id/job/79676596
21-Oct-24 03:29;IT Team Leader - System (Contract);PT Net One Asia;South Jakarta;Contract/Temp;https://www.jobstreet.co.id/job/79631873
23-Oct-24 03:53;System Storage Engineer;PT Graha Karya Informasi;Jakarta;Contract/Temp;https://www.jobstreet.co.id/job/79697642
21-Oct-24 07:57;DevOps Engineer - Fully REMOTE;CP AXTRA PUBLIC COMPANY LIMITED;Jakarta;Contract/Temp;https://www.jobstreet.co.id/job/79640695
21-Oct-24 09:28;L1 Cloud Support Engineer;PT Data Labs Analytics;Central Jakarta;Full time;https://www.jobstreet.co.id/job/79643121
21-Oct-24 02:49;IT Business Analyst;PT. TALENTA TEKNOLOGI SUKSES GEMILANG;Jakarta;Contract/Temp;https://www.jobstreet.co.id/job/79630287
23-Oct-24 03:09;System Engineer;PT Karya Solusi Prima Sejahtera;South Jakarta;Full time;https://www.jobstreet.co.id/job/79695703
18-Oct-24 03:36;Java Developer;PT Indocyber Global Teknologi;Jakarta;Contract/Temp;https://www.jobstreet.co.id/job/79594600
22-Oct-24 09:30;Software Engineer -  Competitive Intelligence;PT Trinusa Travelindo;Jakarta;Full time;https://www.jobstreet.co.id/job/79687707
17-Oct-24 10:47;Full Stack Engineer;PT DIGITAL XCELERATION NUSANTARA;South Jakarta;Full time;https://www.jobstreet.co.id/job/79579262
23-Oct-24 08:02;L2 Linux Engineer;PT Metrocom Global Solusi;South Jakarta;Full time;https://www.jobstreet.co.id/job/79705276
22-Oct-24 07:09;IT System Engineer;PT. Berca Hardayaperkasa;Central Jakarta;Contract/Temp;https://www.jobstreet.co.id/job/79676577
22-Oct-24 09:52;Server Engineer - IT Consultant (A-112371);RGF HR Agent Indonesia;Central Jakarta;Full time;https://www.jobstreet.co.id/job/79680816
23-Oct-24 11:12;Data Protection Officer (manajerial);PT Bintraco Dharma Tbk;Tangerang;Full time;https://www.jobstreet.co.id/job/79709285
23-Oct-24 06:44;Software Engineer Internship;Private Advertiser;South Jakarta;Full time;https://www.jobstreet.co.id/job/79703464
23-Oct-24 06:04;IT Digital Transformation Department Head;PT. INTEGRA INDO LESTARI;Sidoarjo;Full time;https://www.jobstreet.co.id/job/79701112
22-Oct-24 09:30;Backend Engineer;PT Trinusa Travelindo;Jakarta;Full time;https://www.jobstreet.co.id/job/79687725
22-Oct-24 09:42;Cyber Security Engineer - IT Consulting (A-112375);RGF HR Agent Indonesia;Central Jakarta;Full time;https://www.jobstreet.co.id/job/79680682
23-Oct-24 05:30;Engineer On Site;PT QUINSIS LINTAS MITRA;Jakarta;Contract/Temp;https://www.jobstreet.co.id/job/79697846
23-Oct-24 08:30;Delivery Manager;General Electric International Operations Co.inc;Jakarta;Full time;https://www.jobstreet.co.id/job/79714282
23-Oct-24 06:54;Frontend Engineer (Flutter);PT Nomura Research Institute Indonesia;Central Jakarta;Contract/Temp;https://www.jobstreet.co.id/job/79042508
23-Oct-24 12:53;VOIP Network Engineer;PT Anabatic Technologies;South Tangerang;Full time;https://www.jobstreet.co.id/job/79710368
22-Oct-24 04:18;Python Developer;PT Bumi Amartha Teknologi Mandiri;South Jakarta;Contract/Temp;https://www.jobstreet.co.id/job/79668376
23-Oct-24 06:54;DevOps Engineer;PT Nomura Research Institute Indonesia;Central Jakarta;Contract/Temp;https://www.jobstreet.co.id/job/79042516
22-Oct-24 01:26;Cloud Engineer;PT. Metrodata Electronics, Tbk;West Jakarta;Full time;https://www.jobstreet.co.id/job/79653659
22-Oct-24 09:30;Software Engineer - Backend (Corporate Technology);PT Trinusa Travelindo;Jakarta;Full time;https://www.jobstreet.co.id/job/79687696
22-Oct-24 09:31;Senior Oracle Database Administrator (OCA);PT Sisindokom Lintasbuana;Central Jakarta;Full time;https://www.jobstreet.co.id/job/79680259
22-Oct-24 23:50;Data Center Technician 3-IT;PT Oracle Indonesia;Jakarta;Full time;https://www.jobstreet.co.id/job/79696820
22-Oct-24 09:48;Linux Engineer - IT Consultant (A-112378);RGF HR Agent Indonesia;Central Jakarta;Full time;https://www.jobstreet.co.id/job/79680768
17-Oct-24 08:00;Software Engineer (Web) (Customer Care);PT Trinusa Travelindo;Jakarta;Full time;https://www.jobstreet.co.id/job/79584181
22-Oct-24 04:29;Senior Software Development Engineer in Test/SDET (Katalon);PT. Wide Technologies Indonesia;South Jakarta;Full time;https://www.jobstreet.co.id/job/79668707
22-Oct-24 08:00;Quality Engineer - AM;PT Asuransi Jiwa Manulife Indonesia (Dept PB Danamon);Jakarta;Full time;https://www.jobstreet.co.id/job/79686740
17-Oct-24 02:49;IT System Support Junior Staff - Trading (A-112186);RGF HR Agent Indonesia;West Jakarta;Full time;https://www.jobstreet.co.id/job/79564387
22-Oct-24 08:00;Sr Customer Solution Engineer - PMO;General Electric International Operations Co.inc;Jakarta;Full time;https://www.jobstreet.co.id/job/79686700
23-Oct-24 07:27;System Analyst;Private Advertiser;Tangerang;Full time;https://www.jobstreet.co.id/job/79704619
22-Oct-24 03:16;Product & Development Team;PT Gudang Kripto Indonesia;South Jakarta;Full time;https://www.jobstreet.co.id/job/79657548
23-Oct-24 06:52;Business Analyst;PT Sharing Vision Indonesia;Central Jakarta;Full time;https://www.jobstreet.co.id/job/79702562
21-Oct-24 13:31;Sparepart Management Data Analyst Officer;PT SMART,Tbk;Central Jakarta;Full time;https://www.jobstreet.co.id/job/79645802
21-Oct-24 04:28;Solution Engineer;PT SOD Technology Indonesia;Jakarta;Full time;https://www.jobstreet.co.id/job/79634268
21-Oct-24 08:55;System Analyst;PT Electronic Data Interchange Indonesia (Member of Pelindo);Jakarta;Contract/Temp;https://www.jobstreet.co.id/job/79641852
23-Oct-24 19:15;Senior Technical Program Manager - Engineering Platform;PT Aplikasi Karya Anak Bangsa (GO-JEK Indonesia);Jakarta;Full time;https://www.jobstreet.co.id/job/79714247
21-Oct-24 07:39;Data Management Specialist;PT Andika Mitra Sejati;East Jakarta;Full time;https://www.jobstreet.co.id/job/79640239
21-Oct-24 09:46;Technical Odoo;PT Electronic Data Interchange Indonesia (Member of Pelindo);Surabaya;Contract/Temp;https://www.jobstreet.co.id/job/79643580
23-Oct-24 07:36;Junior Flutter Developer;PT Green City Traffic;South Jakarta;Full time;https://www.jobstreet.co.id/job/79704794
21-Oct-24 12:00;Senior Analyst - Innovation Cloud Development Center - Outsystems Developer - ID;Deloitte;Jakarta;Full time;https://www.jobstreet.co.id/job/79648202
21-Oct-24 07:44;Engineer;PT Dimulti Pilar Narmadi;Depok;Contract/Temp;https://www.jobstreet.co.id/job/79640345
23-Oct-24 10:56;Front End (Angular) Developer;PT Lawencon Internasional;South Jakarta;Full time;https://www.jobstreet.co.id/job/79709172
21-Oct-24 09:41;Mobile Developer;Petsgolden;Tangerang;Full time;https://www.jobstreet.co.id/job/79643211
22-Oct-24 22:20;Product Manager (Transport);PT Aplikasi Karya Anak Bangsa (GO-JEK Indonesia);Jakarta;Full time;https://www.jobstreet.co.id/job/79691207
20-Oct-24 08:47;Car Connected Services (CCS) Specialist;PT Hyundai Autoever Indonesia;South Jakarta;Full time;https://www.jobstreet.co.id/job/79621588
20-Oct-24 17:43;Technical Leader;PT. HTC Global Software Services;Central Jakarta;Contract/Temp;https://www.jobstreet.co.id/job/79622942
21-Oct-24 01:51;SAP WM Functional;PT Sukanda Djaya;Bekasi;Full time;https://www.jobstreet.co.id/job/79628506
21-Oct-24 13:43;DevOps/SRE;PT SOD Technology Indonesia;Jakarta;Full time;https://www.jobstreet.co.id/job/79645826
21-Oct-24 09:49;Mobile Developer;PT Inovasi Adiwarna Raya;Surabaya;Full time;https://www.jobstreet.co.id/job/79643459
22-Oct-24 09:45;Mobile Developer;PT. Wide Technologies Indonesia;South Jakarta;Full time;https://www.jobstreet.co.id/job/79680735
18-Oct-24 11:44;Quality Assurance Lead;PT Linov Roket Prestasi;South Jakarta;Contract/Temp;https://www.jobstreet.co.id/job/79607514
18-Oct-24 06:46;System Analyst;PT Lawencon Internasional;South Jakarta;Full time;https://www.jobstreet.co.id/job/79601153
17-Oct-24 02:59;Sr Officer-Transport Operations Jakarta Raya;Indosat Ooredoo;Jakarta;Full time;https://www.jobstreet.co.id/job/79564756
18-Oct-24 07:06;Cloud Engineer (Microsoft Solution Specialist);PT Era Awan Digital;Central Jakarta;Full time;https://www.jobstreet.co.id/job/79601639
18-Oct-24 06:54;IT DATA CENTER OPERATION;PT AKR Corporindo, Tbk;West Jakarta;Full time;https://www.jobstreet.co.id/job/79601331
17-Oct-24 07:20;Senior Software Architect;PT SOD Technology Indonesia;Central Jakarta;Full time;https://www.jobstreet.co.id/job/79334705
18-Oct-24 02:45;Digital Process Automation (Business Analyst);PT BCA Finance;South Jakarta;Contract/Temp;https://www.jobstreet.co.id/job/79591380
18-Oct-24 07:20;Data Analyst Jr. Specialist;PT Bussan Auto Finance (BAF);South Jakarta;Full time;https://www.jobstreet.co.id/job/79601881
17-Oct-24 03:43;NOC Data Center;PT Karya Solusi Prima Sejahtera;Jakarta;Contract/Temp;https://www.jobstreet.co.id/job/79567391
17-Oct-24 03:32;IT Specialist & System Development;PT. Mora Telematika Indonesia TBK;Central Jakarta;Contract/Temp;https://www.jobstreet.co.id/job/79566588
16-Oct-24 13:29;Data Analyst;Private Advertiser;East Jakarta;Full time;https://www.jobstreet.co.id/job/79553463
16-Oct-24 15:02;Exterro FTK Virtual License;PT Data Sinergitama Jaya;South Jakarta;Casual/Vacation;https://www.jobstreet.co.id/job/79553877
17-Oct-24 19:49;Senior Data Analyst;PT Aplikasi Karya Anak Bangsa (GO-JEK Indonesia);Jakarta;Full time;https://www.jobstreet.co.id/job/79585053
17-Oct-24 11:41;Data Center Engineering Ops Engineer, DC Communities;Enak Amazon makanan;Jakarta;Full time;https://www.jobstreet.co.id/job/79581326
18-Oct-24 08:11;Data Scientist II;PT Fashion Eservices Indonesia;South Jakarta;Full time;https://www.jobstreet.co.id/job/79608097
22-Oct-24 07:30;Production Support;PT NTT Indonesia;Jakarta;Full time;https://www.jobstreet.co.id/job/79686694
23-Oct-24 02:37;MS Engineer (L2);PT NTT Indonesia;South Jakarta;Full time;https://www.jobstreet.co.id/job/79702866
22-Oct-24 12:19;Cyber Security Engineer - IT Consulting;RGF HR Agent Recruitment;Jakarta;Full time;https://www.jobstreet.co.id/job/79685917
23-Oct-24 05:19;Systems Engineer - 2;Palo Alto Networks;Central Jakarta;Full time;https://www.jobstreet.co.id/job/79707324
