listing_date;title;company;location;work_type;link
03-Oct-24 12:16;Project Manager (Payment Tech);EURONET TECHNOLOGIES INDONESIA;Jakarta;Full time;https://www.jobstreet.co.id/job/79267766
01-Oct-24 08:10;Application Support Manager;Private Advertiser;Jakarta;Full time;https://www.jobstreet.co.id/job/79206539
04-Oct-24 06:49;Network Engineer Lead;PT SYSTEM TREE TECHNOLOGY;South Jakarta;Full time;https://www.jobstreet.co.id/job/79295607
04-Oct-24 08:24;Software Development Team Lead;B2BE GSS Sdn Bhd;Surabaya;Full time;https://www.jobstreet.co.id/job/79298340
04-Oct-24 09:42;Full-Stack Software Engineer (Senior Level);TRAVLR Indonesia;Bali;Contract/Temp;https://www.jobstreet.co.id/job/79300937
05-Oct-24 08:18;Senior Relationship Manager Funding;PT. Dwi Inti Sari;East Jakarta;Full time;https://www.jobstreet.co.id/job/79314134
04-Oct-24 03:52;Technical Support Manager;Cartrack;Jakarta;Full time;https://www.jobstreet.co.id/job/79283829
05-Oct-24 22:15;Senior Internal Audit;PT UangMe Fintek Indonesia;South Jakarta;Full time;https://www.jobstreet.co.id/job/79317562
04-Oct-24 11:38;SENIOR FRONTEND DEVELOPER;AlphaPhilindo Solution Inc;Jakarta;Full time;https://www.jobstreet.co.id/job/79303238
03-Oct-24 09:09;Senior IT Developer;PT Bhinneka Life Indonesia;West Jakarta;Full time;https://www.jobstreet.co.id/job/79263576
03-Oct-24 07:16;Sr. Specialist Financial Planning & Analysis;PT ABM Investama;South Jakarta;Full time;https://www.jobstreet.co.id/job/79260868
03-Oct-24 04:16;Cloud Technology Section Head;PT Multipolar Technology Tbk;Banten;Full time;https://www.jobstreet.co.id/job/79254541
02-Oct-24 12:00;SR&T Consultant, M&A Transaction Diligence, Execution & Reporting;Deloitte;Jakarta;Full time;https://www.jobstreet.co.id/job/79242751
03-Oct-24 03:56;Presales / Solution Specialist;PT Multipolar Technology Tbk;Banten;Contract/Temp;https://www.jobstreet.co.id/job/79253714
04-Oct-24 22:43;Manager - IRAU Credit Risk Senior Analyst - Hybrid;Citibank;Jakarta;Full time;https://www.jobstreet.co.id/job/79310532
04-Oct-24 09:57;Financial Planning & Analysis Sr. Manager;PT Richeese Kuliner Indonesia;Bandung;Full time;https://www.jobstreet.co.id/job/79301744
02-Oct-24 06:08;IT Security Senior Engineer;PT Tower Bersama Infrastructure, Tbk;South Jakarta;Full time;https://www.jobstreet.co.id/job/79227299
04-Oct-24 07:13;IT Service Coordinator;PT. Berca Hardayaperkasa;Jakarta;Full time;https://www.jobstreet.co.id/job/79296406
01-Oct-24 09:54;Senior Enterprise Account Manager;GoPomelo Co., Ltd.;Jakarta;Full time;https://www.jobstreet.co.id/job/79209597
01-Oct-24 04:09;QUALITY CONTROL MANAGER Data Center (Construstion Project);PT YPTT Solutions Indonesia;Bekasi Regency;Contract/Temp;https://www.jobstreet.co.id/job/79199047
01-Oct-24 11:12;Senior Software Engineer;PT Finture Tech Indonesia;South Jakarta;Full time;https://www.jobstreet.co.id/job/79210307
01-Oct-24 07:26;Head of Sales (Cloud);POINTSTAR (PSID);Jakarta;Full time;https://www.jobstreet.co.id/job/79205608
04-Oct-24 10:38;ERP Account Manager;Wilmar Group;Jakarta;Full time;https://www.jobstreet.co.id/job/79302803
04-Oct-24 08:55;Digital Strategic Specialist;PT CIMB Niaga Auto Finance;South Tangerang;Full time;https://www.jobstreet.co.id/job/79299135
04-Oct-24 03:02;Solutions Consultant/Sales Executive (Senior/Junior);PT Perkom Indah Murni (MidPlaza ICT Group);Central Jakarta;Full time;https://www.jobstreet.co.id/job/79280387
04-Oct-24 04:47;Junior Business Analyst;PT Perangkat Lunak Indonesia;Central Jakarta;Full time;https://www.jobstreet.co.id/job/79290310
01-Oct-24 00:37;Senior Web Developer to manage CS Cart website;SCHNAP Electric Products;Jakarta;Contract/Temp;https://www.jobstreet.co.id/job/79191681
30-Sep-24 11:00;Site Reliability Engineer;PT Justika Siar Publika;South Jakarta;Full time;https://www.jobstreet.co.id/job/79183643
04-Oct-24 03:23;ERP Senior Staff;Indonesia Equipment Centre;North Jakarta;Contract/Temp;https://www.jobstreet.co.id/job/79280912
03-Oct-24 14:42;Software Project Manager;PT Inovasi Kreatif Digital;Jakarta;Full time;https://www.jobstreet.co.id/job/79268776
03-Oct-24 09:52;IT Manager;Private Advertiser;Central Jakarta;Full time;https://www.jobstreet.co.id/job/79266436
03-Oct-24 08:46;SPV Project (ICT/Telco);Private Advertiser;Jakarta;Full time;https://www.jobstreet.co.id/job/79262926
04-Oct-24 04:00;Product Operations Analyst;PT Trinusa Travelindo;Jakarta;Full time;https://www.jobstreet.co.id/job/79303863
03-Oct-24 03:23;Regional Service Manager;PT Mitra Karsa Utama;Semarang;Contract/Temp;https://www.jobstreet.co.id/job/79251186
03-Oct-24 08:01;Head of IT - Banking;PT Michael Page Internasional Indonesia;Jakarta;Full time;https://www.jobstreet.co.id/job/79261963
03-Oct-24 03:27;ICT Operational Supervisor;PT Maybank Indonesia Finance;Central Jakarta;Full time;https://www.jobstreet.co.id/job/79252562
03-Oct-24 08:54;Senior Odoo Software Developer;PT Asia Bandar Alam;Central Jakarta;Contract/Temp;https://www.jobstreet.co.id/job/79263088
03-Oct-24 06:48;Mobile App Developer (Mid-Senior Level);Busana Apparel Group;South Jakarta;Full time;https://www.jobstreet.co.id/job/79260050
03-Oct-24 09:40;Business Analyst (Contract Base);PT ZURICH ASURANSI INDONESIA, Tbk;Jakarta;Full time;https://www.jobstreet.co.id/job/79265607
03-Oct-24 08:20;Staff-RAN, MW & Fiber Ops & Performance North Sumatera;Indosat Ooredoo;Medan;Full time;https://www.jobstreet.co.id/job/79262351
03-Oct-24 09:55;Product Solution;PT Multi Bangun Abadi;South Jakarta;Contract/Temp;https://www.jobstreet.co.id/job/79266446
04-Oct-24 02:35;Sr. Associate, Specialist, Digital Channel Management;PT Bank DBS Indonesia;Jakarta;Full time;https://www.jobstreet.co.id/job/79301318
03-Oct-24 04:06;Business Process Improvement Analyst;PT. Rupa Aestetika Teknologi Aktual (RATA);Jakarta;Full time;https://www.jobstreet.co.id/job/79254129
03-Oct-24 02:38;IT Project Manager;Trans Retail Group;South Jakarta;Full time;https://www.jobstreet.co.id/job/79250725
02-Oct-24 07:38;IT SENIOR NETWORK SECURITY;PT Griya Mitra Persada;Central Jakarta;Full time;https://www.jobstreet.co.id/job/79233365
02-Oct-24 03:41;Assistant Manager Operation Technology Project;PT Mitra Transaksi Indonesia;South Jakarta;Casual/Vacation;https://www.jobstreet.co.id/job/79224522
02-Oct-24 06:10;Principal Special Projects/Product - Cryptocurrency;PT Michael Page Internasional Indonesia;Jakarta;Full time;https://www.jobstreet.co.id/job/79229052
02-Oct-24 12:00;Senior Manager - Enterprise Security - OT Security - JKT;Deloitte;Jakarta;Full time;https://www.jobstreet.co.id/job/79242905
02-Oct-24 02:58;Lead Product Manager;PT Amartha Mikro Fintek (Jakarta);South Jakarta;Full time;https://www.jobstreet.co.id/job/79241750
02-Oct-24 09:46;IT Infrastructure & Security Senior Supervisor;PT Etana Biotechnologies Indonesia;East Jakarta;Full time;https://www.jobstreet.co.id/job/79237001
02-Oct-24 04:30;Mobile Flutter Developer (Middle to Senior);PT Indonesia Satu Tujuh;South Jakarta;Full time;https://www.jobstreet.co.id/job/79226298
01-Oct-24 04:02;IT Project Manager;PT Peoplyee Tech Indonesia;Jakarta;Full time;https://www.jobstreet.co.id/job/79198833
01-Oct-24 06:54;Project Manager - IT Consulting (A-109666);RGF HR Agent Indonesia;South Jakarta;Full time;https://www.jobstreet.co.id/job/79204744
02-Oct-24 12:00;Functional Consultant Analyst;PT. Metrodata Electronics, Tbk;West Jakarta;Full time;https://www.jobstreet.co.id/job/79265164
01-Oct-24 11:18;Cloud Operation Manager (Project Based);PT Era Awan Digital;Central Jakarta;Contract/Temp;https://www.jobstreet.co.id/job/79210296
01-Oct-24 23:20;Senior IT Operation Support;PT Sinergi Daya Mitra;Jakarta;Contract/Temp;https://www.jobstreet.co.id/job/79216944
01-Oct-24 03:45;Senior Data Analyst;Yayasan Bina Nusantara;West Jakarta;Full time;https://www.jobstreet.co.id/job/79198351
01-Oct-24 08:08;Junior IT Consultant;PT. Vostra Internasional;Jakarta;Full time;https://www.jobstreet.co.id/job/79206508
01-Oct-24 03:29;IT Business Process Improvement Specialist;PT. Wide Technologies Indonesia;South Jakarta;Full time;https://www.jobstreet.co.id/job/79196993
01-Oct-24 12:00;IT Project Manager;PT. Metrodata Electronics, Tbk;West Jakarta;Full time;https://www.jobstreet.co.id/job/79214699
01-Oct-24 02:55;Business Analyst (Banking Core);PT Karya Solusi Prima Sejahtera;South Tangerang;Full time;https://www.jobstreet.co.id/job/79195531
01-Oct-24 04:02;IT Project Management Support Officer;Yayasan Bina Nusantara;Jakarta;Full time;https://www.jobstreet.co.id/job/79198849
01-Oct-24 04:44;Premier Bancassurance Life Consultant - Bogor;PT AIA FINANCIAL;Bogor;Full time;https://www.jobstreet.co.id/job/79199935
01-Oct-24 09:16;SFS FI & QM Specialist;PT Steel Pipe Industry of Indonesia Tbk;Surabaya;Full time;https://www.jobstreet.co.id/job/79208217
02-Oct-24 02:01;IT PM Business Analyst;PT Insura Media Solusi (Jakarta);Jakarta;Full time;https://www.jobstreet.co.id/job/79220766
01-Oct-24 04:01;Associate Software Engineering Specialist;Yayasan Bina Nusantara;West Jakarta;Full time;https://www.jobstreet.co.id/job/79198808
30-Sep-24 07:14;Program Manager (Digital Automation);ASIA PULP AND PAPER;Tangerang;Full time;https://www.jobstreet.co.id/job/79177036
01-Oct-24 06:21;Business Manager (Leader Cabang) Pantar - Alor;PT Amartha Mikro Fintek (Jakarta);East Nusa Tenggara;Contract/Temp;https://www.jobstreet.co.id/job/79243115
30-Sep-24 04:33;Process Improvement Executive Senior Staff;PT Anugerah Tangkas Transportindo;West Jakarta;Full time;https://www.jobstreet.co.id/job/79171580
30-Sep-24 04:11;Associate Technical Lead Specialist;Yayasan Bina Nusantara;West Jakarta;Full time;https://www.jobstreet.co.id/job/79170986
01-Oct-24 02:14;Project Coordinator;Eterno Aluminium;Surabaya;Full time;https://www.jobstreet.co.id/job/79194352
30-Sep-24 08:01;Head of Operation;PT Persada Inti Utama (Jakarta);Bekasi;Full time;https://www.jobstreet.co.id/job/79178346
30-Sep-24 06:19;Principal Product Strategist;PT Solusi Transportasi Indonesia;South Jakarta;Full time;https://www.jobstreet.co.id/job/79181628
01-Oct-24 00:54;SENIOR WEB DEVELOPER;PT Propan Raya Industrial Coating Chemicals;Tangerang;Full time;https://www.jobstreet.co.id/job/79192104
01-Oct-24 02:37;ERP Supervisor;PT Tangkas Cipta Optimal;Central Jakarta;Full time;https://www.jobstreet.co.id/job/79195027
30-Sep-24 11:14;Dynamics365 Technical Consultant;Technosoft Group;West Jakarta;Full time;https://www.jobstreet.co.id/job/79183720
30-Sep-24 09:53;Senior Software Engineer - Dev Platform;PT Aplikasi Karya Anak Bangsa (GO-JEK Indonesia);Jakarta;Full time;https://www.jobstreet.co.id/job/79184772
02-Oct-24 10:24;Technical Project Manager;PT Sea Group;Jakarta;Full time;https://www.jobstreet.co.id/job/79238947
03-Oct-24 09:54;Service Delivery Manager;PT NTT Indonesia;South Jakarta;Full time;https://www.jobstreet.co.id/job/79268449
04-Oct-24 08:14;Project Manager - IT;Shopee Internasional Indonesia;Jakarta;Full time;https://www.jobstreet.co.id/job/79304011
05-Oct-24 00:00;Consultant / Interim Manager / Partner @ INSECOGO (m/f/d) remote in Malaysia;INSEMACO® Recruiting & Executive Search Consultants GmbH & Co. KG;Kuningan Regency;Full time;https://www.jobstreet.co.id/job/79317787
03-Oct-24 20:24;Senior Backend Core (ATM);PT Alto Network;Central Java;Full time;https://www.jobstreet.co.id/job/79275466
03-Oct-24 03:29;Loyalty and Promotions Product Manager;PT Telkomsel Ekosistem Digital;South Jakarta;Full time;https://www.jobstreet.co.id/job/79271427
02-Oct-24 10:07;Senior Live Ops Game Designer (F2P);PT Gameloft Indonesia (Yogyakarta);Yogyakarta;Contract/Temp;https://www.jobstreet.co.id/job/79238697
03-Oct-24 02:29;Senior Full-Stack Developer;B One Consulting;Badung;Full time;https://www.jobstreet.co.id/job/79250433
02-Oct-24 10:09;Program Engineer;PT OSI ELECTRONICS;Riau Islands;Contract/Temp;https://www.jobstreet.co.id/job/79237382
30-Sep-24 09:30;Senior Account Executive;Kantar;Jakarta;Full time;https://www.jobstreet.co.id/job/79246563
01-Oct-24 01:34;Senior Front End Engineer (Web);PT AJAIB TTX Solusi (jakarta);Jakarta;Full time;https://www.jobstreet.co.id/job/79209304
30-Sep-24 05:00;Chief Partnership Distribution;SUN LIFE INDONESIA;South Jakarta;Full time;https://www.jobstreet.co.id/job/79184623
30-Sep-24 00:00;Technical Lead - IVR;Flintex Consulting Pte Ltd;Jakarta;Full time;https://www.jobstreet.co.id/job/79184618
05-Oct-24 01:59;IT BA & QA Senior;PT. Pilar Teknologi Solusi;South Jakarta;Full time;https://www.jobstreet.co.id/job/79313436
04-Oct-24 08:03;Head of Engineering (Relocation to Malaysia);Company Confidential;Jakarta;Full time;https://www.jobstreet.co.id/job/79303949
04-Oct-24 10:11;Product Development Assistant Manager;PT Asuransi Allianz Life Indonesia;Jakarta;Full time;https://www.jobstreet.co.id/job/79306330
04-Oct-24 08:17;Chief Engineering / Asst. Chief Engineering;Company Confidential;Jakarta;Full time;https://www.jobstreet.co.id/job/79303977
03-Oct-24 09:05;Senior Programmer;PT Aldmic Indonesia (Flower Advisor);West Jakarta;Full time;https://www.jobstreet.co.id/job/79268479
02-Oct-24 07:29;Investment Banking Manager;Czarnikow;Central Jakarta;Full time;https://www.jobstreet.co.id/job/79241739
02-Oct-24 13:44;Cloud Architect;IlmuOne Data;South Jakarta;Full time;https://www.jobstreet.co.id/job/79244255
01-Oct-24 09:44;Finance Associate/Senior Associate;Deliveree (PT Angkut Teknologi Indonesia);Jakarta;Full time;https://www.jobstreet.co.id/job/79229708
01-Oct-24 08:51;Product Architect (Functional);AiChat;Jakarta;Full time;https://www.jobstreet.co.id/job/79214686
30-Sep-24 10:55;Product Owner;Gefami Services Indonesia;Jakarta;Contract/Temp;https://www.jobstreet.co.id/job/79187687
