listing_date;title;company;location;work_type;link
01-Oct-24 09:54;Senior Enterprise Account Manager;GoPomelo Co., Ltd.;Jakarta;Full time;https://www.jobstreet.co.id/job/79209597
05-Oct-24 04:10;Team Leader (Medium Enterprise);Hasjrat Multifinance, PT;Central Jakarta;Full time;https://www.jobstreet.co.id/job/79312616
03-Oct-24 12:16;Project Manager (Payment Tech);EURONET TECHNOLOGIES INDONESIA;Jakarta;Full time;https://www.jobstreet.co.id/job/79267766
04-Oct-24 09:57;Financial Planning & Analysis Sr. Manager;PT Richeese Kuliner Indonesia;Bandung;Full time;https://www.jobstreet.co.id/job/79301744
04-Oct-24 06:49;Network Engineer Lead;PT SYSTEM TREE TECHNOLOGY;South Jakarta;Full time;https://www.jobstreet.co.id/job/79295607
01-Oct-24 08:10;Application Support Manager;Private Advertiser;Jakarta;Full time;https://www.jobstreet.co.id/job/79206539
04-Oct-24 09:42;Full-Stack Software Engineer (Senior Level);TRAVLR Indonesia;Bali;Contract/Temp;https://www.jobstreet.co.id/job/79300937
05-Oct-24 08:18;Senior Relationship Manager Funding;PT. Dwi Inti Sari;East Jakarta;Full time;https://www.jobstreet.co.id/job/79314134
04-Oct-24 11:38;SENIOR FRONTEND DEVELOPER;AlphaPhilindo Solution Inc;Jakarta;Full time;https://www.jobstreet.co.id/job/79303238
02-Oct-24 12:00;Senior Manager - Enterprise Security - OT Security - JKT;Deloitte;Jakarta;Full time;https://www.jobstreet.co.id/job/79242905
04-Oct-24 03:52;Technical Support Manager;Cartrack;Jakarta;Full time;https://www.jobstreet.co.id/job/79283829
04-Oct-24 22:43;Manager - IRAU Credit Risk Senior Analyst - Hybrid;Citibank;Jakarta;Full time;https://www.jobstreet.co.id/job/79310532
04-Oct-24 08:24;Software Development Team Lead;B2BE GSS Sdn Bhd;Surabaya;Full time;https://www.jobstreet.co.id/job/79298340
05-Oct-24 22:15;Senior Internal Audit;PT UangMe Fintek Indonesia;South Jakarta;Full time;https://www.jobstreet.co.id/job/79317562
04-Oct-24 03:02;Solutions Consultant/Sales Executive (Senior/Junior);PT Perkom Indah Murni (MidPlaza ICT Group);Central Jakarta;Full time;https://www.jobstreet.co.id/job/79280387
03-Oct-24 07:16;Sr. Specialist Financial Planning & Analysis;PT ABM Investama;South Jakarta;Full time;https://www.jobstreet.co.id/job/79260868
03-Oct-24 09:09;Senior IT Developer;PT Bhinneka Life Indonesia;West Jakarta;Full time;https://www.jobstreet.co.id/job/79263576
03-Oct-24 04:16;Cloud Technology Section Head;PT Multipolar Technology Tbk;Banten;Full time;https://www.jobstreet.co.id/job/79254541
02-Oct-24 06:08;IT Security Senior Engineer;PT Tower Bersama Infrastructure, Tbk;South Jakarta;Full time;https://www.jobstreet.co.id/job/79227299
02-Oct-24 03:26;Treasury Analyst Manager;Dexa Group;South Tangerang;Full time;https://www.jobstreet.co.id/job/79223863
01-Oct-24 11:12;Senior Software Engineer;PT Finture Tech Indonesia;South Jakarta;Full time;https://www.jobstreet.co.id/job/79210307
01-Oct-24 07:26;Head of Sales (Cloud);POINTSTAR (PSID);Jakarta;Full time;https://www.jobstreet.co.id/job/79205608
02-Oct-24 02:58;Lead Product Manager;PT Amartha Mikro Fintek (Jakarta);South Jakarta;Full time;https://www.jobstreet.co.id/job/79241750
01-Oct-24 10:03;Team Leader - Bangka Belitung;PT Amartha Mikro Fintek (Jakarta);West Bangka;Full time;https://www.jobstreet.co.id/job/79209710
02-Oct-24 12:00;SR&T Consultant, M&A Transaction Diligence, Execution & Reporting;Deloitte;Jakarta;Full time;https://www.jobstreet.co.id/job/79242751
01-Oct-24 04:04;IT Deployment & Asset Management Section Head;Yayasan Bina Nusantara;Jakarta;Full time;https://www.jobstreet.co.id/job/79198900
01-Oct-24 00:37;Senior Web Developer to manage CS Cart website;SCHNAP Electric Products;Jakarta;Contract/Temp;https://www.jobstreet.co.id/job/79191681
04-Oct-24 09:32;Funding & Treasury Division Head;Lembaga Pembiayaan Ekspor Indonesia (Indonesia Eximbank);South Jakarta;Full time;https://www.jobstreet.co.id/job/79300486
30-Sep-24 11:11;Information Security Officer (Manager Level);PT Justika Siar Publika;South Jakarta;Full time;https://www.jobstreet.co.id/job/79183708
04-Oct-24 10:38;ERP Account Manager;Wilmar Group;Jakarta;Full time;https://www.jobstreet.co.id/job/79302803
04-Oct-24 10:31;Collection Analyst/Manager;Geekhunter;Jakarta;Full time;https://www.jobstreet.co.id/job/79302721
05-Oct-24 02:13;Branch Manager Roda Dua - Jakarta;PT KB Finansia Multi Finance;East Jakarta;Full time;https://www.jobstreet.co.id/job/79311832
04-Oct-24 03:23;ERP Senior Staff;Indonesia Equipment Centre;North Jakarta;Contract/Temp;https://www.jobstreet.co.id/job/79280912
04-Oct-24 06:09;Business Manager (Kepala Cabang) Adonara - Nusa Tenggara Timur;PT Amartha Mikro Fintek (Jakarta);East Flores;Full time;https://www.jobstreet.co.id/job/79310002
03-Oct-24 09:52;IT Manager;Private Advertiser;Central Jakarta;Full time;https://www.jobstreet.co.id/job/79266436
03-Oct-24 08:54;Senior Odoo Software Developer;PT Asia Bandar Alam;Central Jakarta;Contract/Temp;https://www.jobstreet.co.id/job/79263088
03-Oct-24 08:01;Head of IT - Banking;PT Michael Page Internasional Indonesia;Jakarta;Full time;https://www.jobstreet.co.id/job/79261963
04-Oct-24 02:35;Sr. Associate, Specialist, Digital Channel Management;PT Bank DBS Indonesia;Jakarta;Full time;https://www.jobstreet.co.id/job/79301318
03-Oct-24 06:48;Mobile App Developer (Mid-Senior Level);Busana Apparel Group;South Jakarta;Full time;https://www.jobstreet.co.id/job/79260050
03-Oct-24 03:23;Regional Service Manager;PT Mitra Karsa Utama;Semarang;Contract/Temp;https://www.jobstreet.co.id/job/79251186
03-Oct-24 14:42;Software Project Manager;PT Inovasi Kreatif Digital;Jakarta;Full time;https://www.jobstreet.co.id/job/79268776
03-Oct-24 08:58;Business Manager (Kepala Cabang) Pantar - Nusa Tenggara Timur;PT Amartha Mikro Fintek (Jakarta);Jakarta;Full time;https://www.jobstreet.co.id/job/79270998
04-Oct-24 01:25;Relationship Manager Hajj & Funding;PT Bank Muamalat Indonesia, Tbk;Jakarta;Full time;https://www.jobstreet.co.id/job/79276959
03-Oct-24 06:36;Full-Stack Web Developer (Mid-Senior level);Busana Apparel Group;South Jakarta;Full time;https://www.jobstreet.co.id/job/79259258
02-Oct-24 07:38;IT SENIOR NETWORK SECURITY;PT Griya Mitra Persada;Central Jakarta;Full time;https://www.jobstreet.co.id/job/79233365
02-Oct-24 07:38;Corporate Finance Manager;PT Abhimata Persada;Central Jakarta;Contract/Temp;https://www.jobstreet.co.id/job/79233380
02-Oct-24 09:46;IT Infrastructure & Security Senior Supervisor;PT Etana Biotechnologies Indonesia;East Jakarta;Full time;https://www.jobstreet.co.id/job/79237001
02-Oct-24 08:08;Sharia Investment Operation;PT Asuransi Allianz Life Indonesia;Jakarta;Full time;https://www.jobstreet.co.id/job/79234072
02-Oct-24 04:30;Mobile Flutter Developer (Middle to Senior);PT Indonesia Satu Tujuh;South Jakarta;Full time;https://www.jobstreet.co.id/job/79226298
02-Oct-24 10:15;Branch Manager (BMDP);PT Smart Multi Finance;Jakarta;Contract/Temp;https://www.jobstreet.co.id/job/79237470
02-Oct-24 06:10;Principal Special Projects/Product - Cryptocurrency;PT Michael Page Internasional Indonesia;Jakarta;Full time;https://www.jobstreet.co.id/job/79229052
03-Oct-24 02:38;IT Project Manager;Trans Retail Group;South Jakarta;Full time;https://www.jobstreet.co.id/job/79250725
01-Oct-24 04:44;Premier Bancassurance Life Consultant - Bogor;PT AIA FINANCIAL;Bogor;Full time;https://www.jobstreet.co.id/job/79199935
01-Oct-24 03:45;Senior Data Analyst;Yayasan Bina Nusantara;West Jakarta;Full time;https://www.jobstreet.co.id/job/79198351
01-Oct-24 23:20;Senior IT Operation Support;PT Sinergi Daya Mitra;Jakarta;Contract/Temp;https://www.jobstreet.co.id/job/79216944
01-Oct-24 04:02;IT Project Manager;PT Peoplyee Tech Indonesia;Jakarta;Full time;https://www.jobstreet.co.id/job/79198833
01-Oct-24 06:54;Project Manager - IT Consulting (A-109666);RGF HR Agent Indonesia;South Jakarta;Full time;https://www.jobstreet.co.id/job/79204744
01-Oct-24 03:41;Relationship Manager Funding - KoinWorks Bank;PT Lunaria Annua Teknologi (KoinWorks);South Tangerang;Full time;https://www.jobstreet.co.id/job/79198090
01-Oct-24 08:33;Enterprise Risk Management and KYC Assistant Manager;Hanwha Life Insurance Indonesia;Jakarta;Full time;https://www.jobstreet.co.id/job/79206988
01-Oct-24 06:21;Business Manager (Leader Cabang) Pantar - Alor;PT Amartha Mikro Fintek (Jakarta);East Nusa Tenggara;Contract/Temp;https://www.jobstreet.co.id/job/79243115
01-Oct-24 11:18;Cloud Operation Manager (Project Based);PT Era Awan Digital;Central Jakarta;Contract/Temp;https://www.jobstreet.co.id/job/79210296
01-Oct-24 04:51;Investor Relation Section Head;Agung Sedayu Group;North Jakarta;Full time;https://www.jobstreet.co.id/job/79200112
01-Oct-24 07:46;Transaction Monitoring Dept Head;PT. PERSOLKELLY Recruitment Indonesia;South Tangerang;Full time;https://www.jobstreet.co.id/job/79206076
01-Oct-24 10:10;Relationship Manager Funding (Cikarang);PT Bank Bukopin Tbk;Bekasi Regency;Contract/Temp;https://www.jobstreet.co.id/job/79209789
01-Oct-24 09:16;SFS FI & QM Specialist;PT Steel Pipe Industry of Indonesia Tbk;Surabaya;Full time;https://www.jobstreet.co.id/job/79208217
01-Oct-24 07:52;Settlement & Dispute Management Dept Head;PT. PERSOLKELLY Recruitment Indonesia;South Tangerang;Full time;https://www.jobstreet.co.id/job/79206187
30-Sep-24 04:33;Process Improvement Executive Senior Staff;PT Anugerah Tangkas Transportindo;West Jakarta;Full time;https://www.jobstreet.co.id/job/79171580
30-Sep-24 08:01;Head of Operation;PT Persada Inti Utama (Jakarta);Bekasi;Full time;https://www.jobstreet.co.id/job/79178346
30-Sep-24 09:28;Relationship Manager SMEs Lending - Semarang;PT Lunaria Annua Teknologi (KoinWorks);Semarang;Full time;https://www.jobstreet.co.id/job/79181684
30-Sep-24 07:14;Program Manager (Digital Automation);ASIA PULP AND PAPER;Tangerang;Full time;https://www.jobstreet.co.id/job/79177036
01-Oct-24 00:54;SENIOR WEB DEVELOPER;PT Propan Raya Industrial Coating Chemicals;Tangerang;Full time;https://www.jobstreet.co.id/job/79192104
30-Sep-24 06:19;Principal Product Strategist;PT Solusi Transportasi Indonesia;South Jakarta;Full time;https://www.jobstreet.co.id/job/79181628
30-Sep-24 09:27;Relationship Manager SMEs Lending - Surabaya/Jember;PT Lunaria Annua Teknologi (KoinWorks);East Java;Full time;https://www.jobstreet.co.id/job/79181427
30-Sep-24 02:58;Branch Head (SULAWESI);PT Wahana Ottomitra Multiartha (WOM Finance), Tbk;South Sulawesi;Full time;https://www.jobstreet.co.id/job/79167851
30-Sep-24 11:15;Ops. Risk Management Jr. Specialist;PT Home Credit Indonesia;Jakarta;Full time;https://www.jobstreet.co.id/job/79183735
01-Oct-24 02:51;Area Bancassurance Manager - Magelang;PT AIA FINANCIAL;Magelang;Contract/Temp;https://www.jobstreet.co.id/job/79195415
30-Sep-24 09:53;Senior Software Engineer - Dev Platform;PT Aplikasi Karya Anak Bangsa (GO-JEK Indonesia);Jakarta;Full time;https://www.jobstreet.co.id/job/79184772
03-Oct-24 09:54;Service Delivery Manager;PT NTT Indonesia;South Jakarta;Full time;https://www.jobstreet.co.id/job/79268449
05-Oct-24 00:00;Consultant / Interim Manager / Partner @ INSECOGO (m/f/d) remote in Malaysia;INSEMACO® Recruiting & Executive Search Consultants GmbH & Co. KG;Kuningan Regency;Full time;https://www.jobstreet.co.id/job/79317787
04-Oct-24 08:14;Project Manager - IT;Shopee Internasional Indonesia;Jakarta;Full time;https://www.jobstreet.co.id/job/79304011
04-Oct-24 14:15;Head of Credit Risk and Underwriting;Xendit;Jakarta;Full time;https://www.jobstreet.co.id/job/79308682
03-Oct-24 20:24;Senior Backend Core (ATM);PT Alto Network;Central Java;Full time;https://www.jobstreet.co.id/job/79275466
03-Oct-24 03:29;Loyalty and Promotions Product Manager;PT Telkomsel Ekosistem Digital;South Jakarta;Full time;https://www.jobstreet.co.id/job/79271427
03-Oct-24 18:40;Solutions Consultant - FSI, Indonesia;Palo Alto Networks;Central Jakarta;Full time;https://www.jobstreet.co.id/job/79273305
02-Oct-24 10:07;Senior Live Ops Game Designer (F2P);PT Gameloft Indonesia (Yogyakarta);Yogyakarta;Contract/Temp;https://www.jobstreet.co.id/job/79238697
02-Oct-24 03:56;Business Manager (Kepala Cabang) Nusa Tenggara Timur;PT Amartha Mikro Fintek (Jakarta);East Nusa Tenggara;Contract/Temp;https://www.jobstreet.co.id/job/79224976
03-Oct-24 02:29;Senior Full-Stack Developer;B One Consulting;Badung;Full time;https://www.jobstreet.co.id/job/79250433
02-Oct-24 10:24;Technical Project Manager;PT Sea Group;Jakarta;Full time;https://www.jobstreet.co.id/job/79238947
01-Oct-24 13:05;SENIOR BACKEND DEVELOPER - MEDAN;Private Advertiser;North Sumatra;Part time;https://www.jobstreet.co.id/job/79211484
30-Sep-24 09:30;Senior Account Executive;Kantar;Jakarta;Full time;https://www.jobstreet.co.id/job/79246563
30-Sep-24 05:00;Chief Partnership Distribution;SUN LIFE INDONESIA;South Jakarta;Full time;https://www.jobstreet.co.id/job/79184623
01-Oct-24 01:34;Senior Front End Engineer (Web);PT AJAIB TTX Solusi (jakarta);Jakarta;Full time;https://www.jobstreet.co.id/job/79209304
30-Sep-24 12:48;Service Supervisor - Bali Branch;PT Rentokil Initial Indonesia;Lombok;Full time;https://www.jobstreet.co.id/job/79187011
30-Sep-24 00:00;Technical Lead - IVR;Flintex Consulting Pte Ltd;Jakarta;Full time;https://www.jobstreet.co.id/job/79184618
03-Oct-24 09:05;Senior Programmer;PT Aldmic Indonesia (Flower Advisor);West Jakarta;Full time;https://www.jobstreet.co.id/job/79268479
05-Oct-24 01:59;IT BA & QA Senior;PT. Pilar Teknologi Solusi;South Jakarta;Full time;https://www.jobstreet.co.id/job/79313436
02-Oct-24 07:29;Investment Banking Manager;Czarnikow;Central Jakarta;Full time;https://www.jobstreet.co.id/job/79241739
04-Oct-24 08:17;Chief Engineering / Asst. Chief Engineering;Company Confidential;Jakarta;Full time;https://www.jobstreet.co.id/job/79303977
04-Oct-24 08:03;Head of Engineering (Relocation to Malaysia);Company Confidential;Jakarta;Full time;https://www.jobstreet.co.id/job/79303949
04-Oct-24 10:11;Product Development Assistant Manager;PT Asuransi Allianz Life Indonesia;Jakarta;Full time;https://www.jobstreet.co.id/job/79306330
